resultados_nlp/comparacion_modelos_nlp.csv

metodo,representacion,cv_f1_macro_media,cv_f1_macro_std,cv_accuracy_media,test_f1_macro,test_accuracy,vocabulario,estado
ninguno,unigramas,0.7153599785340345,0.03586578927113788,0.792756915753679,0.7075706169418807,0.7827298050139275,5839,OK
ninguno,unigramas_bigramas,0.7161348722085892,0.028726703162844543,0.8039174407691027,0.6858756361203361,0.7771587743732591,15485,OK
stemming,unigramas,0.7147326364386485,0.0351602961542188,0.7913666014637042,0.7202187197668296,0.7966573816155988,3634,OK
stemming,unigramas_bigramas,0.7198580431340827,0.0325725895694388,0.8109011751152747,0.7091059756409089,0.8105849582172702,16099,OK
lematizacion,unigramas,0.7074756758401719,0.02486593506928664,0.7892701654050039,0.7136200446075257,0.7994428969359332,4462,OK
lematizacion,unigramas_bigramas,0.7094444980574509,0.036375272638063276,0.8046162527886693,0.7203049269016285,0.8105849582172702,16608,OK

resultados_nlp/informe_comparaciones.md

## ninguno + unigramas

- F1 macro CV (3 folds, solo train): 0.7154 ± 0.0359
- Accuracy CV: 0.7928
- F1 macro test: 0.7076
- Accuracy test: 0.7827
- Tamaño del vocabulario: 5839

## ninguno + unigramas_bigramas

- F1 macro CV (3 folds, solo train): 0.7161 ± 0.0287
- Accuracy CV: 0.8039
- F1 macro test: 0.6859
- Accuracy test: 0.7772
- Tamaño del vocabulario: 15485

## stemming + unigramas

- F1 macro CV (3 folds, solo train): 0.7147 ± 0.0352
- Accuracy CV: 0.7914
- F1 macro test: 0.7202
- Accuracy test: 0.7967
- Tamaño del vocabulario: 3634

## stemming + unigramas_bigramas

- F1 macro CV (3 folds, solo train): 0.7199 ± 0.0326
- Accuracy CV: 0.8109
- F1 macro test: 0.7091
- Accuracy test: 0.8106
- Tamaño del vocabulario: 16099

## lematizacion + unigramas

- F1 macro CV (3 folds, solo train): 0.7075 ± 0.0249
- Accuracy CV: 0.7893
- F1 macro test: 0.7136
- Accuracy test: 0.7994
- Tamaño del vocabulario: 4462

## lematizacion + unigramas_bigramas

- F1 macro CV (3 folds, solo train): 0.7094 ± 0.0364
- Accuracy CV: 0.8046
- F1 macro test: 0.7203
- Accuracy test: 0.8106
- Tamaño del vocabulario: 16608